"Wed, Aug 22, 2018, 8:45 AM",Mid-week boat dive,Ocean Quest Dive Charters - Des Moines Marina,"22307 Dock Ave S. · Des Moines, WA","We are heading north from Des Moines marina on the Ocean Quest to enjoy a couple of ""reef"" dives: Alki Fishing Reef and Blake Island Fishing Reef. Poke around the structures and look for critters in the crevices, or look up at the schooling rockfish. There is always something to see in these sites. Alki Fishing Reef is an artificial series of rock reefs created to encourage the attraction of fish and other marine life. There are 14 piles of concrete and rock debris that provide great structure for marine habitat set in patterns parallel to shore with depths between 40′ to 80′. Blake Island Reef is composed of concrete slabs, boxes, and other debris to encourage the attraction of marine life. These were barged in and deposited on a sandy/silt sea floor ranging in depths of 40′ to 100′ plus. The structures generally run parallel to the shore of Blake Island and are spread over a considerable distance. You should have at least an advanced certification with experience diving in currents, depths deeper than 60′, good buoyancy skills and experience in mid water ascents using a Surface Marker Buoy (SMB). To ensure that everyone can ""get their money's worth"" from the dive, unless you are signing up with buddy who is okay with shorter dive times, you should be able to get 60 minutes (or somewhere close to it) from your tank. Ocean Quest provides coffee, tea, water as well as sandwiches and hot soup for lunch and delicious post-final-dive cookies! Bring all your gear, including two full tanks. As soon as you sign up on Meetup go immediately to the Ocean Quest website to pay ($90) to reserve your spot. Payment to Ocean Quest is the only way to confirm your place on the boat. (www.oceanquestdivecharters.com) If Meetup is full, get on the waiting list in case someone cancels!"
"Sat, Aug 18, 2018, 11:00 AM",Skyline Wall dive,Skyline Wall,"5919 Cabana Ln, Anacortes, WA · 98221, WA","Meet: 11:00am Splash: 12:10pm Skill Lv: Intermediate to Advanced (Skyline can be a simple dive when conditions are good, but when mother nature throws a curve ball it's a different story). Features Wall, Boulder Pile / Shelves, Kelp Forest Description From the entry point, swim southwest toward the point of a relatively barren sandy bottom which turns to eel grass as you approach the point. Drop down when you reach the beginning of the point (just past the house with the bulkhead and where the steep cliff is on the shore) and follow the contour down and west as the slope becomes more prominent and turns into a series of ledges and then develops into a cascading wall covered in life. During summer months there will be kelp marking the wall so you can descend when you reach the barrier of kelp. The wall cascades down to about 85’ and is comprised of a series of steep shelves, overhangs and large rocks. Life covers nearly every surface of the wall and ledges LOTS of cucumbers and Giant Barnacles cover everything, huge urchins, sponges, GPOs, Puget Sound King Crab, Kelp Greenling, Lingcod, all sorts of perch and rockfish, etc. As you continue west it will become less gradual and you round the point. Come up over 40’ and ride the current back. The shallow section is just as interesting and dynamic as the deeper portions of the wall. Below the bottom of the wall the rock structure gives way to a steep sandy bottom. Special Restrictions: Beware of heavy currents. ONLY dive this site on slack before an ebb current (slack at high tide) or you will be fighting current both directions. Hop into the water about 30 minutes before slack and drift along the wall staying below 45’ on your way out. When you hit the end of the wall (it will start to turn into a slope and not so rocky) or when you are ready to turnaround, head up above 40’ and the current will bring you back toward the entry point. How to get there: From I-5 take exit 230 onto Highway 20 West toward Anacortes. Go all the way through Anacortes toward the Washington State Ferry Terminal. Hwy 20 will turn into Commercial Ave, then 12th, then Oaks just before the terminal. Take a left on Sunset Ave, then left onto Skyline Way, then right onto Cabana Way. Park at the end of the street past the marina on the beach side of the road. There is beach access just before the gate at the end of the road that leads to a house that sits on the water."
"Sat, Aug 18, 2018, 7:30 AM",Morning Dive at Redondo,Redondo Beach,"Redondo Beach Dr. S. & Redondo Way S. · Federal Way, WA","UPDATE: moved meet time up to 7:30am! Let's attempt to splash at 8:00am. Several people have reported seeing sixgill and a skate around 80 feet. Let's try our luck! Even if not, there are plenty of cool critters to see. After the dive, I will be dropping tanks off at Eight Diving in Des Moines; then if there is interest, maybe we can grab a bite to eat near there."
"Fri, Aug 17, 2018, 9:00 AM",Friday AM North End Dive,Bruce Higgins Underwater Trails (Edmonds Underwater Park),"Main St & Railroad Av · Edmonds, WA",Come to Edmonds Underwater Park on a weekday morning: typically plenty of parking. Viz has been spectacular: hopefully will persist. We'll be starting the dive toward high slack. Great opportunity for photography. Good outdoor showers to rinse gear after; and best air-fills in the region at Edmonds Underwater Sports. Bring a picnic lunch for after if you'd like or refreshments nearby. Meet at 9AM; Splash 9:45....
"Thu, Aug 16, 2018, 7:00 PM",Evening Dive at Boeing Dock,Edgewater Beach,"1st Street · Mukilteo, WA","Join us at Boeing Dock for an evening dive. Meet at 7:00pm in the Edgewater Beach (not Edgewater Park) parking lot. Splash is planned for 7:30pm. Everyone will need a primary dive light and a backup dive light. Tank strobe is highly recommended. Some of us will go chase crab. There's also a lot of habitat to explore. Crabbers will need valid license, catch bag, and a crab gauge."
"Tue, Aug 14, 2018, 7:00 PM",MBDC Board meeting,"Frontier Bonding Service, LLC","155 NE 100th Street Suite 201 · Seattle, WA",• What we'll do Monthly Board meeting. The usual agenda applies - and a call for priority topics will go out in advance to shape each month's discussion. Please RSVP so that we know if we have a quorum. Members are welcome to attend. Just let us know!
"Mon, Aug 13, 2018, 6:30 PM",Got your crab fix,Edgewater Beach,"1st Street · Mukilteo, WA",Hard description to put... Go catch some crab or come dive with us while the others catch crab.... either we will be dive... do I need to say more...
"Sat, Aug 11, 2018, 9:00 AM",Morning Dive at Three Tree,Three Tree,"3725 SW 170th St · Burien, WA","Three Tree morning dive for all skills. Last time I was here, we spotted several octopuses, at least one of which was a juvenile GPO that we got to play with for several minutes. This site always has something to see. For newer divers it is an easy dive site with many things above 60ft. Have working Primary and secondary dive lights. Tank light recommended. There are no changing rooms or restrooms at this location. After the dive, I plan to swing by Eight Diving in Des Moines to drop off my tanks. After that, I plan to grab a bite and a beer somewhere near the marina there."
"Fri, Aug 10, 2018, 5:00 PM",Monthly new member dive,Bruce Higgins Underwater Trails (Edmonds Underwater Park),"Main St & Railroad Av · Edmonds, WA",Our monthly New Member dive is happening at the Edmonds Underwater Park this month. 5:00 meet for a 5:30 splash here's a chance for new members to get to know old members so everyone has a dive buddy. Or three. One tank dive and after the dive those who are interested will be getting together for a bite and drink at a local place TBD.
"Thu, Aug 9, 2018, 7:00 PM",Evening Dive at Boeing Dock,Edgewater Beach,"1st Street · Mukilteo, WA","Join us at Boeing Dock for an evening dive. Meet at 7:00pm in the Edgewater Beach (not Edgewater Park) parking lot. Splash is planned for 7:30pm. Everyone will need a primary dive light and a backup dive light. Tank strobe is highly recommended. Some of us will go chase crab. There's also a lot of habitat to explore. Crabbers will need valid license, catch bag, and a crab gauge."
"Wed, Aug 8, 2018, 6:30 PM",One Tank night dive,Three Tree,"3725 SW 170th St · Burien, WA","Three Tree, one tank night dive for all skills. Last time I was here we came across a GPO in the open hunting. He was probably 8ft across. We may get lucky and again find him out hunting. This site always has something to see. For newer divers it is an easy dive site with many thing above 60ft. We'll be diving on a high tide and so I expect reasonable viz. Have working Primary and secondary dive lights. Tank light recommended."
"Wed, Aug 8, 2018, 2:30 PM",Weds Afternoon North End Dive,Mukilteo T Dock,"718 Front Street · Mukilteo, WA","If you can get out this afternoon, beat the heat with a dive at the T-dock! Viz has been great and we'll be diving towards high slack. Meet at ~2:30pm and splash ~3:15pm Afterwards, refreshments at Diamond Knot if you'd like, and Mukilteo Farmers Mkt is at Lighthouse Beach Park from 3-7pm"
"Sat, Aug 4, 2018, 10:00 AM",Whibey Island Dive,Keystone Jetty,"12900 Hwy 20 · Coupville, WA","Current predictions seem adequate for a dive at Keystone Jetty, pilings, and points in between (sea-floor hauserline). Come for a one or a two-tank dive! The visiting all three locations gives a good taste of different kinds of life. Today's first dive is at slack before ebb at 11:23am (1 knot flood to a 1.5 knot ebb). Second dive can probably be done between 12:40 and up to 5:20pm when second slack occurs (before a 1.1 knot flood). There is a restaurant across the parking lot for a meal, but it's summer time so consider bringing a bag lunch. Discovery Passes are required. Plenty of parking, bathroom facilities, and shower are available. Meet at 10am, splash at 11:00 for a 50 minute long dive. Actual splash time varies with your expected bottom time. Adjusted slack for that day is around 11:23am and 5:20pm. Mukilteo-Clinton ferry times: 20 min crossing time, plan for the 9am ferry or arrive earlier. Drive time from Clinton to Keystone Jetty is approximately 20 minutes. Ferry schedule found here: http://www.wsdot.wa.gov/ferries/pdf/2018Summer.pdf"
"Sat, Aug 4, 2018, 8:30 AM",Ocean Quest Weekend Boat Charter,Ocean Quest Dive Charters - Des Moines Marina,"22307 Dock Ave S. · Des Moines, WA","For those who work during the popular weekday charters, this one's for you! Join fellow Marker Buoy members for a 2 tank weekend charter to to the South Sound. SUNRISE: The premier of natural underwater reef structures. This reef consists of clay, sandstone, and rock and runs parallel to shore (north/south) beginning at about 45′ and max’s out at around 55-60′. This is a marine protected site, so it contains lots of colorful life – especially wolf eel and octopus, which are the main attraction. POINT DEFIANCE NORTH WALL: This gentle sloping wall consists of sandstone and rock structures beginning at 20′ and generally running down to 70-100′ but most divers choose to stay 70′ or more shallow. Clams that bore horizontal into the wall have made thousands of holes that have become homes for a great deal of marine life. Although this area has octopus and larger fish, most divers admire it for the structure it provides. Please RSVP on this site, then make your $90 payment directly to Ocean Quest at http://oceanquestdivecharters.com/charters/marker-buoy-8-4/."
"Fri, Aug 3, 2018, 1:00 PM",Seahurst Diving,Ed Munro Seahurst Park,"1600 sw seahurst drive sw · Burien, Wa","Easy dive, beginner level. Great to explore eel grass, sandy bottoms, and the sunken barge. Critter watching, flounders, ratfish, rays, nudibranchs and others. We are diving the high tide slack. Bathrooms available, no showers. Splash by 2pm."
"Thu, Aug 2, 2018, 7:00 PM",Evening Dive at Boeing Dock,Edgewater Beach,"1st Street · Mukilteo, WA","Join us at Boeing Dock for an evening dive. Meet at 7:00pm in the Edgewater Beach (not Edgewater Park) parking lot. Splash is planned for 7:30pm. Everyone will need a primary dive light and a backup dive light. Tank strobe is highly recommended. Some of us will go chase crab. There's also a lot of habitat to explore. Crabbers will need valid license, catch bag, and a crab gauge."
"Wed, Aug 1, 2018, 7:00 PM",Monthly Club meeting,Sunset Hill Community Club,"3003 Northwest 66th Street · Seattle, WA",This month we will hear from Brian Imber - a psychotherapist who is doing his doctoral thesis on stress Induced anxiety and panic in recreational scuba divers and is testing innovative approaches to helping divers mediate or eliminate experiencing this issue. Brian is also (of course!) an avid scuba diver and underwater photographer.
"Wed, Aug 1, 2018, 5:30 PM",Pre-MBDC Meeting - Dinner,This Meetup is past,Thai Siam Restaurant,What we'll do: Casual dinner before our club meeting for those who can make it. Please RSVP so that we can give the restaurant a heads up on how many to expect.
"Mon, Jul 30, 2018, 6:30 PM",Got your crab fix,Edgewater Beach,"1st Street · Mukilteo, WA",Hard description to put... Go catch some crab or come dive with us while the others catch crab.... either we will be dive... do I need to say more...
"Fri, Jul 27, 2018, 9:30 PM","Late night, one tank, dive at Cove 2",Alki Cove 2,"1660 Harbor Ave SW · Seattle, Wa","Ever wondered about how things change after dark under the Sound? Let's go take a look and find out on this true night dive. Meet at 9:30pm for a 10:00pm splash while we go check out the dark depths. We will have to be out of the park by 11:30pm. Bring your main light and a backup, with tank lights being highly recommended."
