"Fri, Oct 19, 2018, 6:30 PM",Monthly New Member Dive,Alki Cove 2,"1660 Harbor Ave SW · Seattle, Wa","It's our monthly New Member dive, a chance for old and new members alike to get to know each other and enjoy a dive all at the same time. 6:30pm meet for a 7:00pm splash on this one tank dive. Back up light required and it might be getting to the right time of the year for the seals to start joining us at Cove 2 by then, we'll see. After the dive drinks, food, and conversation at one of the local restaurants/bars TBD for those who are interested."
"Fri, Oct 19, 2018, 8:30 AM",LuJac's Last San Juan Charter,Skyline Marina,"2011 Skyline Way · Anacortes, WA","San Juan Boat dive! Dive sites To Be Determined. Date: Friday, October 19th 2018 This is Phil’s last San Juan Boat Charter before he moves to Pleasant Harbor for the 2019 season only and that will be the end. It’s a sad day as there will not be a San Juan dive charter after Oct 20th 2018. The price is $90 per person and must be paid in advance. We will meet at the boat in Skyline Marina located in Anacortes at 8:00 AM so we can load the gear and leave promptly by 8:30 AM. Expect to return about 4:00 PM. The dives include breakfast snacks, lunch, coffee, tea and bottled water. Lu-Jac's web site is http://www.lujacsquest.com for more information and directions to the boat. Bring your own filled tanks, weights and dive gear. This site selection is only based on the tides but the weather may dictate a different site but not to worry, Phil knows the San Juan’s and he has never disappointed me. The current sites we are planning to dive are...... Each diver who signs up should have a minimum of 50 dives and have been diving within the last 60 days. Previous cold water dives are a must. Thank you, Bruce Brown 425 334-7763 Home 425 512-7457 Cell"
"Thu, Oct 18, 2018, 6:00 PM",West Seattle dive,Alki Cove 2,"1660 Harbor Ave SW · Seattle, Wa","Join me at cove 2 to dive. Meet @ 6 pm, slash @ 6:30 pm. Will need two lights."
"Tue, Oct 16, 2018, 6:30 PM",Edmonds Night Dive,Bruce Higgins Underwater Trails (Edmonds Underwater Park),"Main St & Railroad Av · Edmonds, WA","Join us for a night dive at Bruce Higgins Underwater Trails. We'll meet at 6:30pm and splash some time after 7:00pm. Current is predicted to be minimal, and visibility has been pretty good as we shift into winter. Everyone will need a primary and secondary light; tank strobe is recommended. I've secured a night permit, so we do not have to be concerned with the normal 10:00pm closing time."
"Sat, Oct 13, 2018, 2:00 PM","Day Island GPO Survey, North Wall",Day Island Wall,"Day Island Blvd. W. 19 St. SW (cross Street) · Tacoma, WA","Let's go hunt and count GPO for the Seattle Aquarium. Current dive, out to a small wall. This is the shallower and closer profile with a 'middle' grade current exchange. Suitable for experienced current divers. 2.7 Ebb > 4 PM slack (S. Narrows) > 3.0 Flood (S. Narrows) Splash ~3. Meet ~2 PM. Plan on debriefing after the dive to let traffic dissipate and go home after. We can compare survey notes. Launch from the regular/north entrance, swim some 100+ yards out to the wall @45', drop in, and drift north and back...hopefully. Buddy pairs will be collecting this data: Date of dive Depth Den type General size Location of dive site Bottom substrate How many giant Pacific octopuses were seen at a single dive site during each dive. Is the octopus on eggs This info can be submitted here: https://www.seattleaquarium.org/octopus-survey Fritz 206-525-0736 home 206-370-4720 cell"
"Sat, Oct 13, 2018, 12:00 PM",Edmonds dive and muck around,Edmonds Underwater Park.,"50 Railroad Ave · Edmonds, WA","Hello Team, Im new to the group and just wanted to get out locally and take some pictures. Anyone wanna join?! Very informal gathering, just wanted to set up something casual and hang out with some of the team. Recommend flash lights (just in case), unsure of water quality that day, and the other standard Puget Sound gear."
"Sat, Oct 13, 2018, 8:00 AM",Dive a Titan I Nuclear Missile Silo,Judy's,"8931 Highway 26 W · Royal City, WA","This is an guided dive with underSea adventures the only dive shop allowed to dive there. The dive will be with a dive master from the shop. This will be a two dive event with a max dept of 103ft. Prerequisites and Requirements: Advanced certification or higher required Photocopy verification of C Cards Recent Cold Water Dives Night Diving Light and backup Statement of Understanding Missile Silo Waiver Good physical shape - walk in is moderately difficult Items to Bring -Your advance Dive card. -All your gear, including tanks, weights and snorkel (yes a snorkel, pass divers suggested to bring it as we have a long walk with giant holds in the ground...) For an extra cost you can get a silo certification - $60 for SSI cert, - $85 for PADI (yes PADI cert is more for the same class) If you don't go for the certification, you will just miss doing the exercises, the dive will be the same. I will need two form fill-out and the answer to the questions below. All documents must be e-mail (kevin@brismeur.com) to me no later then 4 week before the event: -Statement of Understanding (form is on there site, link is below) Non--Diver Liability Release and Assumption of Risk Agreement (form is on there site, link is below) -What is your birthday? -What is your advance dive certification #? -Are you getting the certification? What is expected that day: -8 AM Meet at Judy's restaurant. -Dive shop to verify all ID and dive certification. -Drive 10 min to the silo. -Talk about dive plan and training. -Dive 1st silo while visiting 2 rooms. -surface interval of 2 hours -Lunch provided by dive shop (sandwich and beverage) -Dive 2 in the 2nd silo -Pack dive gear to drive to the dry silo and visit the control room (this is not a dive) -Go home ETA 5 PM. For more info visit the site. http://www.underseaadventures.net/titan-i-missile-silo-silo-diving-dive-into-history.htm"
"Tue, Oct 9, 2018, 7:00 PM",MBDC Board meeting,University Heights Community Center,"5031 University Way NE · Seattle, WA",• What we'll do Monthly Board meeting. The usual agenda applies - and a call for priority topics will go out in advance to shape each month's discussion. Please RSVP so that we know if we have a quorum. Members are welcome to attend. Just let us know!
"Mon, Oct 8, 2018, 8:00 AM",LuJac's Boat Charter,Needs a location,$90.00 ,"Long Island Wall Date: Monday, October 8th 2018 The price is $90 per person and must be paid in advance. We will meet at the boat in Skyline Marina located in Anacortes at 8:00 AM so we can load the gear and leave promptly by 8:30 AM. Expect to return about 4:00 PM. The dives include breakfast snacks, lunch, coffee, tea and bottled water. Lu-Jac's web site is http://www.lujacsquest.com for more information and directions to the boat. This site selection is only based on the tides but the weather may dictate a different site but not to worry, Phil knows the San Juan’s and he has never disappointed me. The current sites we are planning to dive are...... Each diver who signs up should have a minimum of 50 dives and have been diving within the last 60 days. Previous cold water dives are a must. Thank you, Bruce Brown 425 334-7763 Home 425 512-7457 Cell"
"Sun, Oct 7, 2018, 9:00 AM",Feeling Crabby?,Edgewater Beach,"1st Street · Mukilteo, WA","Join us at Boeing Dock for a morning dive. Meet at 9:00am in the Edgewater Beach (not Edgewater Park) parking lot. Splash is planned for 9:30am. Everyone will need a primary dive light and a backup dive light. Tank strobe is highly recommended. Some of us will go chase crab. There's also a lot of habitat to explore. Crabbers will need valid license, catch bag, and a crab gauge. ***NOTE: If you intend to retain crab, you will need a *Winter* catch record card. If you had a summer catch record card earlier in the year, it is no longer valid."
"Thu, Oct 4, 2018, 7:00 PM",Evening Dive at Mukilteo T Dock,Mukilteo T Dock,"718 Front Street · Mukilteo, WA","Meet at 7:00pm, splash around 7:30pm. I'm keen on trying to find the Man, if others are interested in that. Otherwise, there's lots to see around the geodome. Primary and backup dive lights are required; tank strobe is recommended. Be aware that the Man may be a bit deeper than 110ft, so I will be using Nitrox 28% as opposed to my usual 32%."
"Thu, Oct 4, 2018, 6:00 PM",Salish Sea in Focus with SeaDoc Society,Pacific Science Center,"200 2nd Ave N · Seattle, WA","PSC is hosting a program on the Salish Sea this evening. Here's the text from the PSC website: ""Join Joe Gaydos, Science Director of the SeaDoc Society, as he guides us on a visually striking, multimedia adventure through the Salish Sea to explore the species and locales that make the local ecosystem so special. At this Science in the City, we’ll soar through the air with the seabirds and dive below the surface alongside creatures like the Steller sea lion, giant Pacific octopus, and Southern Resident Killer Whale. Enjoy a reception before the lecture featuring many of the winning photographers from the SeaDoc Society’s recent Salish Sea in Focus photo contest. Food and beverage included with your ticket; additional beverages will be available for purchase. Tickets are $20 or $14 for Pacific Science Center Members. The night’s programming will feature breathtaking images by the top photographers from the Salish Sea in Focus photo contest. Portion of all ticket sales will go to supporting SeaDoc Society."" Potential for dinner before the event."
"Thu, Oct 4, 2018, 5:30 PM",Volunteer Celebration Friends of Saltwater State Park,Saltwater State Park,"25205 8th Pl S · Des Moines, WA","Dear Friends of Saltwater State Park We want to show our appreciation for YOUR support of the Park – whether you have shared photos, videos, conducted surveys, removed ivy, planted new growth, explored the beach or simply enjoyed the underwater park! Please join us in the Café from 5:30 - 8:30 pm on October 4th to enjoy food, beverages, and even win prizes! We are providing tasty main dishes and refreshing beverages. You are welcome to bring a side dish to share. We have a featured speaker too. You can hear about the importance of watersheds from Kollin Higgins from King County - an especially relevant topic for this Park! Please let us know by September 30th if you can join the festivities by sending your RSVP to friends.saltwater.statepark@gmail.com Thank you for all that you do from the leadership team of Friends of Saltwater State Park"
"Wed, Oct 3, 2018, 7:00 PM",Monthly Club meeting,Sunset Hill Community Club,"3003 Northwest 66th Street · Seattle, WA","Joel Hollander, Associate Curator of Life Sciences at the Seattle Aquarium is our featured speaker for October. He will talk with us about the 17th Annual Giant Pacific Octopus Census (6-14th October), all about these fascinating and iconic animals and how you can get involved in the census!"
"Wed, Oct 3, 2018, 5:30 PM",Pre-Meeting Dinner @ Thai Siam Restaurant,Thai Siam Restaurant,"8305 15th Ave NW · Seattle, wa","Join us for a meal and conversation prior to the Oct. 3, 7:00 PM MBDC Meeting."
"Sat, Sep 29, 2018, 1:40 PM",Way South Current Dive,Day Island Wall,"Day Island Blvd. W. 19 St. SW (cross Street) · Tacoma, WA","Day Island wall, north entrance. -2.8> 3:41 slack >3.3. Splash 2:40pm. This dive is for divers with current experienced or if you think you possess the skills to do this dive but are unsure call me (206-941-8004) and we'll discuss it. We will enter at the north entrance and drift north and return to the same entrance. You must have working primary and secondary lights and have and know how to use a surface marker buoy (SMB). A gardening trowel is recommended should the current be stronger than anticipated. Last time I was there (3 weeks ago) we had 6 GPO's and Wolf Eels. One wolfie was very friendly allowing us to hold and scratch his belly."
"Sat, Sep 29, 2018, 9:00 AM",Way South one tank dive,Les Davis Marine Park,"3931 Ruston Way · Tacoma, WA","Les Davis Marine Park one tank dive. Open to all skill levels. Meetup 9 am, splash 10 am. Tide will have just started to ebb with a 5-foot exchange, so pretty calm dive. This is a good spot for newer divers to meet a potential buddy, gain dive experience and work on your buoyancy. For those experienced divers, it's a site you may not have been to in sometime or if your planning to do the current dive at Day Island afterwards. See Day Island wall dive posting."
"Wed, Sep 26, 2018, 3:00 PM",Non hosted dive,Needs a location,1 comment,"THIS IS A NON-HOSTED DIVE. So, bring your buddy with you. We will be diving Wednesday night. Splashing between 3:30 & 4 pm. at Cove 2, then 6:30 - 7 pm splash at Junkyard. You are most welcome to join us either for one or two, but remember, we are not hosting it."
"Mon, Sep 24, 2018, 9:00 AM",LuJac's Dive Charter,Skyline Marina,"2011 Skyline Way · Anacortes, WA","San Juan Boat dive! Preferred site is Long Island Wall Date: Monday, September 24th 2018 The price is $90 per person and must be paid in advance. We will meet at the boat in Skyline Marina located in Anacortes at 8:00 AM so we can load the gear and leave promptly by 8:30 AM. Expect to return about 4:00 PM. The dives include breakfast snacks, lunch, coffee, tea and bottled water. Lu-Jac's web site is http://www.lujacsquest.com for more information and directions to the boat. This site selection is only based on the tides but the weather may dictate a different site but not to worry, Phil knows the San Juan’s and he has never disappointed me. The current sites we are planning to dive are...... Each diver who signs up should have a minimum of 50 dives and have been diving within the last 60 days. Previous cold water dives are a must. Thank you, Bruce Brown 425 334-7763 Home 425 512-7457 Cell"
"Fri, Sep 21, 2018, 6:00 PM",God's Pocket - Sept. 21-28 2018,God's Pocket Resort,"PO Box 130 · Port Hardy, BC",5 days of diving at the finest cold water resort in the NW. $2000 US. Contact Richard Salas: askphotography@mac.com or 805-453-3360 for details. or Frank Scarabino MBDC member: 360-525-0524 Price will go up significantly next year.
"Thu, Sep 20, 2018, 6:30 PM",I Can Dive at 55!,Bruce Higgins Underwater Trails (Edmonds Underwater Park),"Main St & Railroad Av · Edmonds, WA","Sammy Hagar once sang ""I can't drive 55"" but I certainly believe that ""I Can Dive at 55!"" ... and I'm about to prove it to myself! I've always wanted to do a night dive at Edmonds Underwater Park so please join me as I celebrate my 55th dive (current dive count: 52) on my 55th Birthday! Birthday cake will be provided (yes, that's a bribe to show up). Where: Edmonds Underwater Park Meet: 6:30PM Splash: when ready? Bring: Dive Lights! Party hats (optional) Please RSVP"
"Mon, Sep 17, 2018, 7:00 PM",Edmonds one tank dive,Edmonds Underwater Park.,"50 Railroad Ave · Edmonds, WA",Short notice one tank dive at Edmonds. Jonathan and I just hatched the plan at the picnic and dive today at Saltwater so come on down and enjoy the dive with us. It will be a night dive so bring both a light and a back up light and we need to be out of the park by 10pm
"Sun, Sep 16, 2018, 10:00 AM",Summer Dive and Social,Saltwater State Park,"You know where! · Des Moines, WA","BRING - - Something to grill and something to share. Also dive gear and any other sporting goods, bikes, roller blades or scooters anyone wants to enjoy. I'll have the grill going and the Club supplies utensils, plates, cups, napkins and ice. The park is a state park so alcohol is not allowed. They make me tell you that so be discreet. Plus, either $10.00 USD or a Discovery Pass is required for parking. What -- An all day hang-out in a cool state park with a great deal to offer everyone, divers and non-divers alike. When -- Sunday, September 16th, 2018. All day! Who - YOU! Plus your spouse, your sweetie, your kid, your mailcarrier, the neighbor who drives the convertible, your 9th grade English Lit teacher AND the nice kid who walks dogs - Everyone is invited! Where - Saltwater State Park in Des Moines WA. Everyone dives as the mood strikes them -- since we are there all day, you can dive whenever you'd like. See YOU on the beach!"
"Tue, Sep 11, 2018, 7:00 PM",MBDC Board meeting,University Heights Community Center,"5031 University Way NE · Seattle, WA",• What we'll do Monthly Board meeting. The usual agenda applies - and a call for priority topics will go out in advance to shape each month's discussion. Please RSVP so that we know if we have a quorum. Members are welcome to attend. Just let us know!
"Mon, Sep 10, 2018, 11:00 AM","Mukilteo slacker dive, please join us!",Mukilteo T-dock,"701 Front Street · Mukilteo, WA","Ron and I just decided to dive Mukilteo tomorrow, Monday 9/10, meet at 11 am, splash at 11:30 am. We talked about perhaps doing a deep dive and follow the rope down to the boat. However, this plan can change due to skill level, etc. If you're up for a dive with us, please bring your dive gear and come along :)."
"Fri, Sep 7, 2018, 6:30 PM",Monthly New Member Dive,Redondo Beach,"Redondo Beach Dr. S. & Redondo Way S. · Federal Way, WA","Our Monthly New Member dive is down at Redondo for September. Meet at 6:30pm for a 7:00pm splash this dive is a chance for new members to get to know old members and everyone to enjoy a dive. After the swim we'll be having a beer, food, and conversation at the local bar/resturant (Ivars?) for those that are willing and able. One tank dive, and see you there!"
"Fri, Sep 7, 2018, 11:00 AM",Dive The Muk,Mukilteo T-dock,"701 Front Street · Mukilteo, WA","Join Dave Scholmier, Carolyn Read and me for a ""Yippee its Friday Dive"" at the Mukilteo T Dock located behind the Silver Cloud. Meet time is 11:00 then splash about 11:30. Easy water entry and the dive plan will depend on the experience level of who shows."
"Thu, Sep 6, 2018, 7:00 PM",Meeting Friends of Saltwater State Park,Saltwater State Park,"25205 8th Pl S · Des Moines, WA",Interested in Saltwater State Park? Help support watershed/marine stewardship and amenities for park patrons. Come join us! Contact: friends.saltwater.statepark@gmail
"Thu, Sep 6, 2018, 12:00 PM",Show off Redondo,Highline MAST Aquarium at Redondo,28203 Redondo Beach Dr S · Des Moines,"And it's day two of showing off our local diving to my out of town buddy. Another two tank dive, this time at Redondo."
"Wed, Sep 5, 2018, 7:00 PM",Monthly Club meeting,Sunset Hill Community Club,"3003 Northwest 66th Street · Seattle, WA","Washington Scuba Alliance (WSA) members Jim Trask and Randy Williams are providing a presentation on the latest happenings regarding the planned construction of a new artificial reef at Redondo in Des Moines. Their presentation will show the proposed designs of the new reef, its current status and the future of the area to maintain the Redondo dive site as a prime diver attraction for the Puget Sound. The MaST Center is also involved as the center for science of the new dive area."
"Wed, Sep 5, 2018, 5:30 PM",Pre-MBDC Meeting - Dinner,Thai Siam Restaurant,"8305 15th Ave NW · Seattle, wa",Casual dinner before our club meeting for those who can make it. Please RSVP so that we can give the restaurant a heads up on how many to expect and set up a large table for us.
"Wed, Sep 5, 2018, 12:00 PM","Show off Cove 2, two tank dive",Alki Cove 2,"1660 Harbor Ave SW · Seattle, Wa",I've got a buddy coming in from out of town who loves diving in our local waters. Noon meet time for a 12:30 splash we'll be planning on a two tank dive this afternoon to give him a good taste of this classic site. Join us and enjoy!
"Mon, Sep 3, 2018, 8:00 AM",LuJac's Davidson Rock Charter,Skyline Marina,"2011 Skyline Way · Anacortes, WA","LuJac’s Dive Charter to Davidson Rock Date: Monday, September 3rd (Labor Day) Cost: $90 and must be paid 30 days in advance of the dive. I currently have 3 openings on the Monday, September 3rd LuJac's dive charter to Davidson Rocks in the San Juan’s. This should be considered an advanced dive but should be an exceptional dive. Site Description: http://emeralddiving.com/davidson.html (http://emeralddiving.com/davidson.html) We will meet at the boat in Skyline Marina located in Anacortes at 8:00 AM so we can load the gear and leave promptly by 8:30 AM. Expect to return about 4:00 PM. Lu-Jac's web site is http://www.lujacsquest.com (http://www.lujacsquest.com/) for more information and directions to the boat. The charter includes 2 dives, breakfast snacks, lunch, coffee, tea and bottled water. Each diver who signs up should have a minimum of 50 dives and have been diving within the last 30 days. Previous cold water dives and good buoyancy skills are a must. This site selection is only based on the tides but the weather may dictate a different site but not to worry, Phil knows the San Juan’s and he has never disappointed me. The current sites we are planning to dive are..... Davidson Rock and 2nd Dive TBD. Phil will end his San Juan Island Dive Charter Service at the end of October 2018 and will do some chartering out of Hoods Canal. Phil has been trying to sell the business / Boat for a couple years but no one has stepped up. Thank you, Bruce Brown 425 512-7457 Cell"
"Thu, Aug 30, 2018, 6:30 PM",Evening Dive at Boeing Dock,Edgewater Beach,"1st Street · Mukilteo, WA","UPDATE: moved the meet time to 6:30p so we can finish by dusk. This will be the last Thursday for the summer crab season. Join us at Boeing Dock for an evening dive. Meet at 6:30pm in the Edgewater Beach (not Edgewater Park) parking lot. Splash is planned for 7:00pm. Everyone will need a primary dive light and a backup dive light. Tank strobe is highly recommended. Some of us will go chase crab. There's also a lot of habitat to explore. Crabbers will need valid license, catch bag, and a crab gauge."
"Wed, Aug 29, 2018, 6:00 PM",Down south one tank nite dive,Three Tree,"3725 SW 170th St · Burien, WA","Three Tree one tank night dive open to all skill levels. Meetup is 6:30 pm, splash at 7 pm. Have your equipment partly assemble to help speed up the process. Parking can be a problem, but not impossible. Have working Primary and secondary lights. Highly recommend tank light. I'm expecting partly cloudy and 71 degrees. That's divers weather. Viz should be OK. A lot to be seen 60 feet and above for our newer members and of course the same can be said for below 60ft."
"Mon, Aug 27, 2018, 6:30 PM",Got your crab fix,Edgewater Beach,"1st Street · Mukilteo, WA",Hard description to put... Go catch some crab or come dive with us while the others catch crab.... either we will be dive... do I need to say more...
"Sat, Aug 25, 2018, 5:00 PM","Moonlight Beach Adventure, at Marina Beach park Edmonds Marina.",Edmonds Marina Beach Park,"650 Admiral Way South · Edmonds, WA",Michael McP
"Fri, Aug 24, 2018, 5:30 PM",Help Ron Dive a new site #2: Richmond Beach,Richmond Beach Saltwater Park,2021 NW 190th Pl · Shoreline,"We had so much fun finally getting me to Redondo last month I figured I'd make a regular, monthly, dive around doing it again, at different sites! Once a month, or so, I'll be hosting a dive at a site I have not yet visited, in my quest to dive 'em all! So we'll start off with this Richmond Beach dive. Be warned, it's supposed to kind of suck, with a long walk across a bridge, in gear, to get to the water. But it's close to home (for me) and I'm thinking there is a possibility that the negative reviews are all wrong and we'll find lots of crab there. Or not. Either way, after the dive, those who are up for it will meet for a beer and meal and talk about where the next Ron-makes-his-first-dive-site-trip should be. One tank dive, meet at 5:30pm splash at 6:00pm"
"Thu, Aug 23, 2018, 7:00 PM",Evening Dive at Boeing Dock,Edgewater Beach,"1st Street · Mukilteo, WA","Just two more Thursdays left for this season. Join us at Boeing Dock for an evening dive. Meet at 7:00pm in the Edgewater Beach (not Edgewater Park) parking lot. Splash is planned for 7:30pm. Everyone will need a primary dive light and a backup dive light. Tank strobe is highly recommended. Some of us will go chase crab. There's also a lot of habitat to explore. Crabbers will need valid license, catch bag, and a crab gauge."
"Wed, Aug 22, 2018, 9:00 AM",Weds AM North End Dive,Mukilteo T Dock,"718 Front Street · Mukilteo, WA","If you can get outside this AM, and can't make Myra's Ocean Quest boat dive, come to Mukilteo for a morning dive at the T-dock. Bring a camera if you want, and we can explore the deep line and the geodome. Possible 2nd dive, if interest. Afterwards, refreshments at Diamond Knot if you'd like, and Mukilteo Farmers Mkt is at Lighthouse Beach Park from 3-7pm Meet: 9AM Splash: ~0945 or ~1000"
